exhibitor_id,name,booths,hall,description,seeking_funding,funding_amount,investment_stage,revenue,logo_file,featured,tags
001Pp00001CTHNCIA5,Sensforge Inc,51868,X,"Sensforge is dedicated to creating innovative, AI-driven security solutions that protect our loved ones while capturing life’s beautiful moments.",No,,,,001Pp00001CTHNCIA5.png,,
001Pp00000mmvIGIAY,Sensor ID srl,61001,M,"Sensor ID specializes in the design and production of devices and systems for IoT applications. Sensor ID offers a comprehensive portfolio of electronic modules based on RFID UHF, BLE, and NFC technologies, tailored for a range of applications including access control, waste management, industrial process control, security, and smart home",No,,,,001Pp00000mmvIGIAY.jpg,,
001Pp00001WmzavIAB,senswave,62659,M,"<ABOUT US>  We are taking on new challenges by overcoming technological limitations in wireless, defense, and sensor antenna systems-delivering innovative solutions for next-generation 6G mobile devices.  <KEY PRODUCT>  mmWave Phased Array Antenna Modules and Systems Supporting Handgrip Sensing and Signal Blockage Compensation Functionality",No,,,,001Pp00001WmzavIAB.png,,
0013A00001egXj5QAE,Seoul Metropolitan Government,63300; 63701,M; M,,,,,,0013A00001egXj5QAE.png,,
0014V00003pOcRGQA0,Sercomm USA Inc.,Venetian Palazzo Hospitality Suites,U,"Founded in 1992, Sercomm is a global leader in providing integrated networking and telecom solutions. Partnering with the world’s top service providers, system integrators, and technology companies, Sercomm’s expertise in designing and manufacturing innovative, customized solutions makes embedding connectivity more across the globe.",No,,,,0014V00003pOcRGQA0.jpg,,
0013A00001VMPMjQAP,Seyond,6059,NN,"Seyond, headquartered in California, is a global leader in high fidelity LiDAR solutions, powering a safer, smarter and more mobile world across automotive, intelligent transportation, robotics and infrastructure. Seyond delivers a portfolio of high resolution LiDAR sensors, software, and the Seyond ITS Management Platform (SIMPL).",No,,,,0013A00001VMPMjQAP.jpg,,
001Pp00000XmYLjIAN,SGS North America Inc.,10377,A,"We are SGS – the world's leading testing, inspection and certification company.  Our global connectivity services include wireless and electrical and electronics testing, inspection and certification to support compliance and market access.",,,,,001Pp00000XmYLjIAN.jpg,,
0014V00003wZKaIQAW,"Shanghai Catlink Intelligent Technology Co., Ltd",55948,X,"A high-tech pet company driven by a passion for revolutionizing the pet industry. From monitoring behavioral data to analyzing health conditions through sophisticated algorithms, our products are designed to help cat to live a happier and healthier life.",,,,,0014V00003wZKaIQAW.png,,
001Pp00001TlXxNIAV,"Shanghai DAISCH Automotive Technology Co., Ltd.",10248,A,"DAISCH, founded in 2015, provides high-performance IMUs, sensors, and inertial navigation systems for automotive, robotics, and smart devices. Our precision-calibrated IMUs deliver accurate motion data essential for autonomous driving and advanced control systems trusted by leading global customers.",Yes,2;000;001-15;000;000,Series B,> 1;000;000,001Pp00001TlXxNIAV.png,,
001Pp00000SptqOIAR,"Shanghai Sixunited Intelligent Technology Co,Ltd",35239,D,"Sixunited Intelligent‌ (est. 2015) is a global provider of smart IoT & consumer electronics solutions, specializing in R&D, manufacturing, and operation of intelligent hardware/software. Products include laptops, tablets, Mini PCs, AIO PCs, peripherals, servers, IoT devices, and industrial control equipment.",No,,,,001Pp00000SptqOIAR.png,,
001Pp00000hzcJ0IAI,Shanghai Udexreal Intelligent Technology Ltd,15158,B,"UDEXREAL is a Smart Wearable tech startup pioneering ultra-thin elastic sensors, and expands our product applications into areas such as XR, motion capture, robotics, and digital health. Its patented elastic sensor is only 0.1mm thin, seamlessly integrating into fabric to create wearables with high accuracy.",No,,,,001Pp00000hzcJ0IAI.png,,
0013A00001W4XsfQAF,"Shenzhen Aoni Electronic Co., Ltd.",31101; 53559,D; X,"Aoni started with webcam entrepreneurship, focus on R & D and manufacturing of the audio & video than 18 years, In the context of AI and IoT, focusing on smart home, smart travel, smart office products’ audio & visual data collection, transmission and processing. Main products are PC cameras, IP cameras, Dash Cam, and BT headsets.",,,,,0013A00001W4XsfQAF.jpg,,
001Pp00001G3KOfIAN,"Shenzhen Beauty Magic Cube Robot Co., Ltd.",54466,X,"Shenzhen Beauty Magic Cube Robot Co., Ltd focuses on intelligent robot R&D and application. Specializing in humanoid, ultrasonic, physiotherapy & rehabilitation robots and IoT platforms, it integrates R&D, production and sales. Committed to empowering healthcare via robotics, it aims to lead the industry.",No,,,,001Pp00001G3KOfIAN.png,,
0013000001KYVRsAAP,"Shenzhen Besiter Power Bank Co., Ltd.",31900,D,"Shenzhen Besiter Power Bank Co., Ltd, a leading provider of sharing power bank solutions. With a rich product line and years of manufacturing expertise, we pride ourselves on delivering high-quality power bank solutions to meet diverse needs. Our experienced team is dedicated to innovation and customer satisfaction.",,,,,0013000001KYVRsAAP.png,,
0013000000k539uAAA,"Shenzhen C&D Electronics Co., Ltd.",52065,X,"-Founded in Aug 2004  -Headquartered in Shenzhen; globally diversified manufacturing in China and Vietnam  -Over 21 years of experience in remote control design and manufacturing  -Main business: remote controls, control boards, smart home products, IoT products and modules",No,,,,0013000000k539uaaa.png,,
0013A00001ZWDRoQAP,"Shenzhen Chileaf Electronics Co.,Ltd",56535,X,"Shenzhen Chileaf Electronics Co., Ltd is a modern high-tech enterprise integrating product development, production, and sales of smart fitness wearable products, household electronics, and therapy devices. The company was established in May 2018. We launched our headquarters and R&D center in Shenzhen and production base in Dongguan.",,,,,0013A00001ZWDRoQAP.jpg,,
001Pp00001Wj6KrIAJ,"Shenzhen Csip Science & technology co., ltd",36405,D,"CSIP specializes in custom Lithium-ion battery solutions with in-house OEM/ODM. We delivers high-performance, safe, and reliable products backed by global support. All products are low-carbon compliant and certified to UL, CE, KC, RoHS, etc. Partner with us for cutting-edge power technology.",No,,,,001Pp00001Wj6KrIAJ.jpg,,
001Pp00001W0I6xIAF,"Shenzhen Dianyang Technology co., ltd.",36046,D,"Focuses on the research and development, production and supply of infrared thermal imaging cameras, providing solutions to customers around the world. Its products are widely used in industrial and civilian fields, including electrical inspection, vehicle diagnosis, PCBA repair, materials testing, night vision, predictive maintenance.",No,,,,001Pp00001W0I6xIAF.png,,
0013A00001a1JDpQAM,"Shenzhen Fine Offset Electronics Co., Ltd.",52668,X,"Shenzhen Fine Offset Electronics Co., Ltd is a distinguished supplier of professional Wi-Fi weather stations, 4G weather station and so on. Ecowitt is committed to help people know more about the accurate weather condition around them by providing quality environmental monitoring instruments.",,,,,0013A00001a1JDpQAM.png,,
0013000001KaN1HAAV,"Shenzhen Forever Young Technology Co., Ltd.",52669,X,"Shenzhen Forever Young Technology Co.,Ltd  Set up in 2012, we focus on smart home products for years, including Smart IR Remote, Temperature & humidity sensor, security sensor and gateway hubs. Our mission is to help customers worldwide to experience the most cutting-edge smart home tech through our persistent innovation and development",,,,,0013000001KaN1HAAV.png,,
001Pp00001Hbrr7IAB,Shenzhen Four Seas Global Link Network Technology,53471,X,"We were founded in 2009,Specialized in wireless network equipment manufacture.  Our product line has covered the entire wireless network equipment field,including:Wireless adapter,Wireless repeater,Wireless access point,Wifi bridge,WiFi6/7/MESH/4G/5G router,AC controller,PoE switch,etc.",No,,,,001Pp00001Hbrr7IAB.jpg,,
0013000001KYVK2AAP,"Shenzhen Geniatech Inc., Ltd.",52159,X,"Geniatech, implements and is responsible for customer lead projects together with its design partners, such as Renesas, Qualcomm, NXP, NVIDIA, STM, Microsoft, Google, Amlogic, Arrow, Future, ON, IBM, Bosch. The process extends in hardware and software from the development of first demonstration samples, to PoC to design industrialization",,,,,0013000001KYVK2AAP.jpg,,
001Pp00000HuTtaIAF,Shenzhen Huachuang Hengda Technology Ltd.,10176,A,"MOKO SMART is a leading manufacturer and provider of ODM, OEM, and IoT devices in China, focusing on IoT technology and comprehensive product lines including Bluetooth Low Energy, LoRaWAN, Wi-Fi, RFID, GPS, LTE, UWB and other wireless technology. This emphasizes MOKO’s commitment to innovation and diverse wireless products.",No,,,,001Pp00000HuTtaIAF.png,,
0013A00001YWGF4QAP,"Shenzhen Jimi IoT Co., Ltd.",10863,A,"Jimi IoT is an experienced provider of IoT solutions, offerings encompassing hardware R&D, platform development and deployment, and system integration. Our business spans multiple sectors, including ELD fleet management solutions, video telematics solutions, cold chain management solutions, and trailer management solutions.",No,,,,0013A00001YWGF4QAP.png,,
001Pp00000iKHrOIAW,Shenzhen Kcool innovation information technology C,62919,M,"GLYDE: Fresh Home Haircuts, No Skills Required    Meet GLYDE: the world’s first smart hair clipper. With auto-adjusting blades and app-guided precision, it is built to replace costly, time-consuming barber visits. In under 10 minutes you can go from messy to fresh at home with zero mistakes.",Yes,250;000-2;000;000,Series A,<500;000,001Pp00000iKHrOIAW.png,,
0013000001N8wotAAB,"Shenzhen Kenvox Technology Co., Ltd.",31903,D,"Kenvox is a Chinese national High-tech comprehensive manufacturing enterprise group, which fully owns three state-of-the-art factories in addition to other joint-ventures primarily in Shenzhen and Dongguan. We have specialized in design and development, mold making, finished parts of plastics, silicone, and metal fabrication.",,,,,0013000001N8wotAAB.png,,
001Pp000012xJLBIA2,"Shenzhen Lingdu Technology Co., Limited",51452,X,"LNDU is a leading innovator in premium IoT hardware, with over 15 years of experience in developing and delivering high-quality smart devices, including:   · Smart Locks & Security Cameras  · Automotive Dashcams  · Pet Tech & Smart Home Solutions  We create innovative, reliable tech to enhance daily life.",No,,,,001Pp000012xJLBIA2.png,,
001Pp000002KzqzIAC,"Shenzhen Linwear Innovation Technology Co., Ltd..",54268,X,"Shenzhen Linwear Innovation Technology Co., Ltd is dedicated to provide unique&high performance products globally. With 12+ years experience, we are able to provide \""one-stop solution\"" from R&D, manufacturing, marketing to brand operation.   There is entry level BT calling smartwatch, classic design collection, precise GPS series,AMOLED BT",,,,,001Pp000002KzqzIAC.png,,
0013A00001TrNkBQAV,"Shenzhen Minew Technologies Co., Ltd.",8568,A,"Minew is a leading loT device manufacturer and innovator, providingcutting-edge smart devices and solutions worldwide. With decadesof experience, we offer a diverse range of products integrating ad-vanced technologies such as Bluetooth beacon, sensor, GPS trackerBLE Wi-Fi gateway and LoRa Gateway.",,,,,0013A00001TrNkBQAV.png,,
0013000001KaMaWAAV,"Shenzhen Neo Electronics Co., Ltd.",53759,X,"Established in 2002,Shenzhen Neo Electronics Co Ltd is a high tech enterprise which focuses on the research, design manufacture and sales of network digital product . It is one of the earliest professional manufacturers of Smart home in China , We mainly produce smart device with different of WIFI ,Zigbee, Zwave, Matter protocols .",,,,,0013000001KaMaWAAV.png,,
0013000001KYVVfAAP,"Shenzhen Phonemax Technology Co., Ltd.",54159,X,"Phonemax is committed to offer one-stop solution including product definition, exclusive software&hardware customization, mass production, exporting and sustainable after-sales service. We have gained great customer satisfaction by producing uniquely designed, industry leading rugged IP68 terminals, top quality IP68 industrial handhelds.",,,,,0013000001KYVVfAAP.png,,
0013000001KYVK7AAP,"Shenzhen Pkcell Battery Co., Ltd.",31947,D,"Shenzhen Pkcell Battery Co., Ltd is a professional battery supplier from China for more than 20 years. Our mian products are alkaline battery,Carbon battery,button cell battery,NI-MH battery,lithium battery.And we have certifications of  CE,ROHS,Reach,CB etc.",,,,,0013000001KYVK7AAP.jpg,,
0014V00001znIf8QAE,Shenzhen Qianhai Woer Technology Limited,16045,B,"TOZO was founded in 2015 in Seattle.Powered by 30+ million users; Commented by 1M+ thousand customers. TOZO team is committed to researching and developing and producing high-tech digital products. Includes wireless audio, acoustic devices, smart IOT devices, virtual reality, and digital accessories.",,,,,0014V00001znIf8QAE.png,,
0013000001KYVAWAA5,"Shenzhen Reflying Electronic Co., Ltd",30533,D,"Founded in 2006,Shenzhen Reflying Electronic Co.,Ltd is a MFiV7.0 top 10 KEY licensee who is able to develop and manufacture a wide range of consumer electronics such as lightning cables,Apples watch charger,MagSafe Charger,Wireless Charger,Smart Home Products compatible with Homekit and Find My network products.",,,,,0013000001KYVAWAA5.png,,
0014V00003Iy9lzQAB,"Shenzhen Ricomm Technology Co., Ltd.",30732,D,"RICOMM is a leading professional manufacturer in the 3C electronics industry in Dongguan, China, founded in 2008. Ricomm specializes in manufacturing PD/GaN wall chargers from 20-140W, 370W charging station, car chargers, cables, wireless chargers and providing one-stop power supply solutions & OEM/ODM services for ACTION, SATURN ECT.",,,,,0014V00003Iy9lzQAB.png,,
0014V00003nke5aQAA,"Shenzhen Ruiara Co., Ltd.",31600,D,"RUIARA, founded in 2017 in Shenzhen, is a manufacturer of premium fiber optic products. With 100+ experts and advanced facilities, we supply POF, MPO/MTP, patch cords, sensors, and Toslink/RCA cables for audio, industrial, and medical use. Certified ISO9001, CE, RoHS, REACH, RUIARA delivers innovative connectivity solutions globally.",No,,,,0014V00003nke5aQAA.jpg,,
001Pp00001Wj8piIAB,"Shenzhen Shenan Yangguang electronics co., ltd.",36415,D,"Established in 1995 in Shenzhen, we are a leading manufacturer of home security and smart home products. With a 10,000㎡ factory and full OEM/ODM capability, we provide one-stop solutions from design to production—turning your ideas into reliable, high-quality products.",No,,,,001Pp00001Wj8piIAB.png,,
001Pp0000039Jg4IAE,"Shenzhen Ultra Easy Technology Co., Ltd.",56335,X,"Shenzhen Ultra-Easy Technology Co., Ltd. (UTE), founded in 2012, is a top smart wearable core solution provider. Specializing in Bluetooth tech, we offer comprehensive products, algorithms, patents, and APP/backend services with over 14 years of expertise.",No,,,,001Pp0000039Jg4IAE.jpg,,
001Pp00001Fi3sHIAR,"Shenzhen Wan AlChef Technology Co., Ltd.",51219,X,"wan AIChef​ is an AIoT innovator in culinary digital intelligence that revolutionizes kitchen experiences through a ""Data + Algorithm + Hardware"" framework.     Deeply integrating nutritional science, we make healthy eating accessible to everyone, advance public health standards, and unlock the wonders of intelligence in health.",No,,,,001Pp00001Fi3sHIAR.png,,
001Pp00001OuQweIAF,"Shenzhen XmiTech Electronic Co., Ltd",51672,X,"With 20 years of expertise, Xmitek is an R&D-driven company specializing in low-power IP video technology. From hardware to cloud to AI, we deliver seamless solutions across outdoor cameras, video doorbells, smart locks, baby monitors, bird feeders, and more.  At Xmitek, we lead with innovation, deliver on performance, and stand on trust.",No,,,,001Pp00001OuQweIAF.jpg,,
0014V00003pPC1CQAW,"Shenzhen Zhiling Technology Co.,Ltd",52365,X,"aosu is a leading smart home solutions provider, dedicated to bringing a sense of security and peace of mind to families worldwide. By combining simplicity with advanced AI technology, aosu delivers innovative products such as video doorbells and solar-powered security cameras, designed to make modern living safer and more connected.",No,,,,0014V00003pPC1CQAW.png,,
001Pp00000joxB7IAI,"Shinsung Delta Tech Co.,Ltd.",53252,X,"Shinsung Deltatech is making a good company with good people.  Shinsung Deltatech, founded in 1987, has been driven by a spirit of constant challenge, guided by a management philosophy of self-realization, customer satisfaction, and love for neighbors. We are actively expanding across the world to create a future of mutual growth.",,,,,001Pp00000joxB7IAI.png,,
0013A00001W600aQAB,"Sichuan Changhong Neonet Technologies Co., Ltd.",52352,X,"Changhong Network devoted to Networking products and IoT products.    Our advantage is to develop products according to customer requirements，we own experienced R&D team, complete testing lab , large-scale  manufacturing ability,  strict quality control and mature project management experience.     OEM/ODM/Joint development are welcome!",,,,,0013A00001W600aQAB.png,,
001Pp00000nh1EPIAY,"Sierra BASE Co., Ltd.",50523,X,"Robot intelligent 3D autonomous operation solution, SIRIUS    Sierra Base is a venture company that provides 3D modeling and autonomous inspection service solutions at various facilities and sites using autonomous drones & robots developed with its own technology.",Yes,2;000;001-15;000;000,Series B,> 1;000;000,001pp00000nh1epiay.png,,
0013A00001eg19sQAA,SiFive,Venetian Palazzo Hospitality Suites; Venetian Palazzo Hospitality Suites 2,U; U,"SiFive is the founder and leader of RISC-V computing. SiFive’s high performance compute platforms have enabled leading technology companies to deliver the most advanced solutions across every market segment of chip design, including AI, ML, automotive, data center, mobile, and consumer. With SiFive, the future of RISC-V has no limits.",,,,,0013A00001eg19sQAA.png,,
001Pp000004QvtEIAS,"Signlab Co., Ltd",50363,X,"SIGNLAB is a startup company established in 2015 with creativity and passion, aiming to lead the next generation of smart technologies and culture in Korea.",No,,,,001Pp000004QvtEIAS.png,,
0013000001KaMcEAAV,Silicon Labs,Toscana 3604; Toscana 3605; Toscana 3706; Toscana 3708; Toscana 3709; Toscana 3710,H; H; H; H; H; H,"The leader in silicon, software and solutions for a smarter, more connected world.",,,,,0013000001KaMcEAAV.png,,
001Pp00000nmB0CIAU,SIMSTech,50123,X,"SIMSTech's surgical instrument tracking and laser marking technology is innovative. The 2mm UDI codes are consistently recognizable, enabling the simultaneous identification of multiple reusable instruments within 0.8 seconds with 100% accuracy. It supports full lifecycle tracking under the UDI system and is not based on RFID technology.",,,,,001Pp00000nmB0CIAU.png,,
001Pp0000043yGgIAI,Skylink Global,51965,X,A Complete telecommunications solutions provider.,,,,,001Pp0000043yGgIAI.jpg,,
001Pp00000dfwkrIAA,SkyMirr,8162,A,"SkyMirr is the creator of revolutionary, AI Driven; Wireless and IOT Communication Technologies. SkyMirr's unique MULCAT technology can improve IOT wireless connectivity significantly. Our solutions offer innovation to Energy, Geolocation, Biomedical and terrestrial and non-terrestrial communications",,,,,001Pp00000dfwkrIAA.jpg,1,
001Pp00001Ir8uDIAR,"Sleno Co., Ltd.",8169,A,"Sleno Co., Ltd. is an innovative South Korean startup specializing in Massive IoT Network and Real-time Kinematic (RTK) technology. Our devices power smart city applications such as safety monitoring, smart agriculture, smart factories, smart metering, disaster response system and autonomous vehicles—ensuring critical data arrives first.",No,,,,001Pp00001Ir8uDIAR.png,,
001Pp00000jcLhTIAU,Smart E&C,50123,X,"Smart E&C develops IoT-based ICT systems for SOC disaster safety, providing predictive monitoring and early-warning solutions. Recognized with major awards, its innovations—Smart Terra Sense and a slope-failure early warning system—enhance public safety.",No,,,,001Pp00000jcLhTIAU.png,,
001Pp00001O4eIKIAZ,Smart Hip Guardian,61047,M,"Briggs Health Solutions has created a patented, predictive, protective wearable called the Smart Hip Guardian, that can tell the difference between everyday activities and a fall event.  In the event of a fall, the Smart Hip Guardian deploys protective pads to help prevent hip fractures while automatically contacting first responders.",Yes,2;000;001-15;000;000,Seed,<500;000,001Pp00001O4eIKIAZ.png,,
0013A00001QjvS0QAJ,"Smart Medical Device Co., Ltd.",53417,X,"Safe Smart Insole 'Kokasin' is a redesigned insole-type wandering device created to prevent the disappearance of elderly individuals with dementia and those with developmental disabilities. Originally launched as a shoe-type product, 'Kokasin' has been improved with a new communication system and re-released as an insole.",,,,,0013A00001QjvS0QAJ.png,,
0013A00001YWEJTQA5,Smart Radar System,4159,NN,"Smart Radar System is a company that develops 4D image radar technology. It integrates 3D information about surrounding objects distance, speed, and angle with height data and applies deep learning technology to accurately perceive the environment. This innovative technology is garnering significant attention in the AD/ADAS  market.",,,,,0013A00001YWEJTQA5.png,,
0013A00001a1ClAQAU,smartmicro,4153,NN,"At smartmicro, we design, develop, and manufacture sensor solutions for traffic management and automotive industries. For more than 27 years we have been the leading specialist in high performance radar technology.",No,,,,0013A00001a1ClAQAU.png,,
001Pp000004ReDcIAK,SmartONE Solutions,50755,X,"SmartONE created a new product offering called the \""Smart Community\"" by connecting smart homes together over a building network. The solution is bundled with internet and sold through large telecommunication companies to multi-family residential developments.",,,,,001Pp000004ReDcIAK.png,,
0013000000k53L6AAI,Smoothtalker - Mobile Communications Inc.,8462,A,We are a North American Cellular Signal Booster Manufacturer. In 2001 we designed the first digital mobile amplifier in North America to receive FCC & Industry Canada approval. We continue to lead with the most powerful &  intelligent Cellular Signal Boosters in the world. Our products are “commercial grade” & outperform competing brands.,No,,,,0013000000k53L6AAI.png,,
0013000001KaMHkAAN,Socionext America Inc.,9439; Westgate Hospitality Suites,A; N,"Socionext Inc. is a global SoC (System-on-Chip) supplier and a pioneer of a unique “Solution SoC” business model through decades of industry experience and expertise. Socionext contributes to global innovation in advanced technologies including automotive, data center, networking, and smart devices. More info at: https://socionextus.com/",No,,,,0013000001KaMHkAAN.png,,
0013000001JxrIqAAJ,SoftAtHome,Suite 29-209,J,"SoftAtHome is an independent software provider with solutions on broadband, Wi-Fi, analytics, QoE monitoring, and a gateway app store. Our solutions power over 30 million connected homes globally. With its focus on energy efficiency and OS communities like prpl, SoftAtHome continues to innovate for the future of the connected home.",,,,,0013000001jxriqaaj.jpg,,
0014V00003Awd5IQAR,"Somos, Inc.",10970,A,"Building Stronger Connections between Consumers, Brands and Communities.    Somos is committed to helping organizations protect their IoT devices from potential security threats. As a leading authority in identity management, fraud prevention and data solutions, Somos offers a key value proposition to the IoT ecosystem.",No,,,,0014v00003awd5iqar.png,,
001Pp00000nEgCsIAK,Sonaide,60801,M,MAKING SENSE OF SOUNDS :  On-device sound detection technology embedded in existing devices for health and safety.,Yes,250;000-2;000;000,Pre-seed,<500;000,001Pp00000nEgCsIAK.png,,
0013A00001VLQuvQAH,"SOS LAB Co., Ltd.",6641,NN,SOS LAB provides proprietary LiDAR sensors. Our high-quality products will make future mobility and infrastructure much more innovative and safer.,No,,,,0013A00001VLQuvQAH.png,,
0013A00001eZORvQAO,SoundHound AI,5867,NN,"SoundHound AI, a global leader in voice and conversational AI, helps businesses create better customer experiences. Our proprietary technology and AI agent platform automate natural conversations in multiple languages across key customer channels. Each year, we process billions of interactions for world-class companies.",No,,,,0013A00001eZORvQAO.png,,
001Pp00001Vm4H9IAJ,Sounteco Inc,35348,D,"Sounteco Inc, an American enterprise has been focusing on easy-to-use electronic products, senior mobile phones, Open Ear Headphones, smart terminals, IOT products with her own R&D, Manufacturing, Sales and Service.  Her Open Ear Headphones are sold in BestBuy, Visons, Canadiantire in North America, with tens of millions of users wordwide",No,,,,001Pp00001Vm4H9IAJ.jpg,,
0013A00001XUVvFQAX,Specialty Coating Systems,8775,A,"SCS is a world leader in Parylene, liquid, plasma, ALD and multilayer conformal coating services and technologies with 21 worldwide locations and over 50 years of experience. SCS conformal coatings offer excellent moisture, chemical and dielectric barrier protection to components across various industries.",No,,,,0013a00001xuvvfqax.jpg,,
