exhibitor_id,name,booths,hall,description,seeking_funding,funding_amount,investment_stage,revenue,logo_file,featured,tags
0014V00003waMPDQA2,.simstechnology,54668,X,"A personal safety wearable device that detects and alerts you when someone or something is approaching you from behind.  Our camera-based detection patented device will give you peace of mind anywhere and anytime whether you're on a walk out alone at night, or just going about your day, the. sims wearable will have your back  ""Live Freely""",No,,,,0014V00003waMPDQA2.jpg,,
0013A00001a1LD1QAM,1NCE,10171,A,"1NCE offers a software platform for connected products that delivers future-proof, hassle-free IoT in +170 countries. The software platform enables customers to easily, securely, and reliably collect device data and turn it into actionable intelligence. 20,000+ customers trust 1NCE with 22 million connected products worldwide.",No,,,,0013A00001a1LD1QAM.jpg,,
0014V00003AxS1IQAV,2Pi,15556,B,"2Pi develop advanced metasurface flat optics technology. We pioneer a new class of optical components and solutions with unprecedented performance, ultra-compactness, and light-weight for use in consumer electronics, industry automation, automotive and beyond.",,,,,0014V00003AxS1IQAV.jpg,,
001Pp00001MsWu1IAF,4rge.ai (by Triangle Man LLC),8072,A,"Groundbreaking motion tracking solutions for the 2030s! Introducing new and intelligent motion tracking solutions including the Trifecta-K series of high-performance IMUs and Trifecta-M series of satellite-inertial navigation systems, 4rge.ai will fuel new industrial and consumer automation solutions over the next decade and beyond.",Yes,2;000;001-15;000;000,Pre-seed,<500;000,001Pp00001MsWu1IAF.png,,
001Pp00001SQnfZIAT,75way Technologies Pvt. Ltd.,8700,A,"75way offers a broad range of digital software services serving Enterprise, SME's, Startup Industries:  AI/ML Software Development   Web applications & software development.  Mobile application development.  Custom software applications and startup solution support.  Blockchain applications.   IOT App Development",No,,,,001Pp00001SQnfZIAT.png,,
001Pp00000lbvNeIAI,"Abe Kogyo Co., Ltd",8774,A,"Our company, with over 80 years of history, experts in \""wooden doors,\"" \""fittings,\"" and \""custom furniture.\""  We are committed to the beauty and functionality of wood, pursuing deep knowledge of its appeal and utilizing the advantage of natural resource to our daily lives.",No,,,,001Pp00000lbvNeIAI.jpg,,
001Pp00001WoqF3IAJ,Abitat,62242,M,,Yes,250;000-2;000;000,Seed,<500;000,,,
001Pp000003MuMoIAK,ACE Ontario Tech University,4566,NN,"ACE is North America’s premier Climatic Testing Facility. Creating controlled and repeatable weather in a full-scale lab environment is what we do. We can create -40C to +60C as well as wind, rain, snow and fog in our Climatic Wind Tunnel. ACE has the facility and the expertise that companies need to develop & validate their products.",,,,,001Pp000003MuMoIAK.jpg,,
001Pp00001NbmBFIAZ,ACELIFE CO LTD,50523,X,"We, Acelife Co, are the leading manufacturer of Digital toilet, Smart toilet, Bidet toilet seat and Espresso machine in KOREA. We are specialized in OEM/ODM business for years.   The products got Int'l standard such as cUPC, WATER SENSE, ETL, CE, PSE, KC approvals, ISO 14001 and 9001",No,,,,001Pp00001NbmBFIAZ.jpg,,
001Pp00000p2DVHIA2,"actnano, Inc.",Westgate Hospitality Suites,N,"actnano is the magic behind the tech that advanced electronics rely on. Unlike traditional conformal coatings, our advanced PCBA protective technologiescan be applied directly on connectors, antennas, LEDs and high-heat generating components eliminating expensive masking, allowing for full protection while saving time and reducing costs.",,,,,001Pp00000p2DVHIA2.png,,
001Pp00001Ui5YTIAZ,Adjusted Coaching d.o.o.,60658,M,,,,,,001Pp00001Ui5YTIAZ.png,,
001Pp000005ASzTIAW,ADM Tech LLC,9563,A,"Tera, based in California, is a leading supplier of barcode scanners, mobile computers, PDAs, cash register drawers, and EV chargers. It is recognized as an Amazon Best Seller and Amazon's Choice for barcode scanners. Its products are renowned by Fortune 500 global enterprises, U.S. government departments, and school districts.",,,,,001Pp000005ASzTIAW.png,,
0013000001KaLvPAAV,ADT,Bellini 2001A; Bellini 2002,X; X,"ADT provides safe, smart and sustainable solutions for people, homes and small businesses. Through innovative offerings, unrivaled safety and a premium customer experience, we empower people to protect and connect to what matters most. For more information, visit www.adt.com.",,,,,0013000001KaLvPAAV.png,,
001Pp00000QVXU2IAP,Adw Sensor Corp.,10529,A,"ADW SENSOR is a technology-driven company specializing in the research, design, and sales of intelligent sensors and their applications. ADW's products include vehicle ultrasonic sensors, ultrasonic flow sensors, and distance measuring sensors, mainly applied in automotive electronics, smart meters, and smart home appliances.",,,,,001Pp00000QVXU2IAP.png,,
001Pp00001TZbwLIAT,Aequil Science,60711,M,"AEQUIL® Science pioneers biophysics, using low-frequency, low-energy fields to bridge biophysical and biochemical science for safer solutions.",Yes,250;000-2;000;000,Seed,> 1;000;000,001Pp00001TZbwLIAT.jpg,,
0013A00001VMyVZQA1,Aeva,6919,NN,"Aeva (NYSE: AEVA) is a global technology company brining the next wave of perception to a broad range of applications from automated driving to industrial robotics and beyond. Aeva 4D LiDAR sensors uniquely detect velocity and 3D position simultaneously, allowing autonomous vehicles and robots to make more intelligent and safe decisions.",,,,,0013A00001VMyVZQA1.png,,
0013A00001QlNsoQAF,Afero,Wynn Encore Hospitality Suites,P,"Afero is the leading secure IoT Platform as a Service.  Afero technology merges simplicity, ease of use, security, and data privacy into the entire solution, from manufacturing to product to cloud to end user. The Afero platform provides enterprise-grade security providing your customers with fast onboarding and direct to device failover.",,,,,0013A00001QlNsoQAF.png,,
001Pp00000ZD2VBIA1,Africa Pavilion,63518,M,"Second Edition of the Africa Pavilion — a landmark showcase of African innovation at the heart of CES.    A dynamic space where the continent’s boldest startups, visionary creators, and breakthrough technologies shine.  Discover the ingenuity, creativity, and forward-thinking spirit driving Africa’s future on the global tech stage.",Yes,2;000;001-15;000;000,Seed,501;000-1;000;000,001Pp00000ZD2VBIA1.png,,
0014V00001zm927QAA,AgeTech Collaborative from AARP,53423; 54123,X; X,"The AgeTech Collaborative™ from AARP® brings together a one-of-a-kind ecosystem of key stakeholders, united in their mission to improve people’s lives as they age. Backed by decades of AARP’s exclusive longevity insights, subject-matter experts, and hands-on guidance, we are driving innovation at the nexus of longevity and technology.",No,,,,0014V00001zm927QAA.png,,
001Pp00001Nlcs7IAB,Agilno Technologies Inc.,50755,X,"Agilno is a global AI-first development studio helping companies turn emerging intelligence into real products. From early-stage startups to Fortune 500 enterprises, we work side by side to design and scale technology that connects the digital and physical world and moves industries forward.",No,,,,001Pp00001Nlcs7IAB.jpg,,
001Pp00001TxEWLIA3,"Agora, Inc",51226,X,"Agora is the global leader in real-time engagement, providing flexible APIs that enable developers to embed conversational AI, voice, video, live streaming, and chat into any app or IoT device. Trusted by 1,800+ leading organizations globally to power real-time experiences in social, live shopping, telehealth, and more. (NASDAQ: API)",No,,,,001Pp00001TxEWLIA3.jpg,,
001Pp00000nPPFAIA4,"AIBIZ Co., Ltd.",62817,M,"AIBIZ specializes in industrial AI solutions for advanced manufacturing. Our flagship platform, DutchBoy, leverages deep learning and sensor data for real-time anomaly detection, root cause analysis, and process optimization. Trusted by global leaders in semiconductors, batteries, and renewable energy, we drive efficiency and innovation.",,,,,001Pp00000nPPFAIA4.png,,
001Pp00001ZVoOsIAL,aida innovazione,61601,M,"Aida Innovazione is an Italian tech company specializing in IoT, AI, and Big Data solutions for monitoring, analytics, and automation. It develops platforms for real-time data collection, diagnostics, and smart management of critical infrastructures, industry systems, mobility, and smart-city services.",Yes,15;000;001-50;000;000,Series A,> 1;000;000,001Pp00001ZVoOsIAL.png,,
001Pp00001MYvhqIAD,AIDIN Robotics Inc.,8871,A,"AIDIN ROBOTICS develops and manufactures high-performance F/T sensors that provide precise sensing for collaborative and humanoid robots. We also offers robot hands, grippers, and integrated automation solutions and export 14 countries. We'll unveil the new obotic hand and next-generation humanoid sensor in this CES2026.",No,,,,001Pp00001MYvhqIAD.png,,
001Pp000008U6jwIAC,AiDot Inc.,52339,X,"AiDot improves quality of life through technological development, and delivers tomorrow's smart home today. AiDot utilizes smart home technology to address the real needs of today’s busy world and deliver not only convenience, but true peace of mind.",,,,,001Pp000008U6jwIAC.png,,
001Pp00000FjPGHIA3,"Aigo (Beijing) Electronics Co.,Ltd",10341,A,"Aigo was founded in 1993 with a powerful aspiration: \""We want people to enjoy quality electronics at affordable prices.\"" Guided by this mission, we have dedicated over three decades to making technology accessible and enjoyable for everyone. Our slogan： “Go Fun”！",,,,,001Pp00000FjPGHIA3.png,,
001Pp00001ULJ15IAH,"AIMneXt Co., Ltd.",50123,X,"AIMNEXT spun off from AIMMED in 2024 to specialize in the R&D and commercialization of Digital Therapeutics (DTx). We aim to improve healthcare outcomes by providing evidence-based, safe, effective, and equitable software interventions for patients. We plan to showcase our fertility improvement healthcare service at CES 2026.",No,,,,001Pp00001ULJ15IAH.jpg,,
0014V00003Zcm97QAB,Airoha Technology,Suite 29-222,J,"Airoha Technology Corp., a subsidiary of MediaTek Inc., is a leading IC design company specializing in fixed broadband network infrastructure and advanced AIoT solutions. Airoha delivers comprehensive, high-value chip solutions in Bluetooth® Audio, Satellite Positioning, Fiber Gateway, Ethernet, and Optical DSP.",No,,,,0014V00003Zcm97QAB.png,,
001Pp00001VxW4sIAF,Airoma AI Limited,63200,M,World’s First AI Driven True Smell Recognition Sensor - Pioneer in true smell recognition by combining MEMS technology and AI learning to bring smell recognition into everyday applications.,No,,,,001Pp00001VxW4sIAF.png,,
001Pp00000p9egoIAA,AIsolution,50763,X,"Leading the Paradigm of Learning and Meeting Solutions for AI Smart Classrooms and Offices    We are evolving into a global artificial intelligence convergence development company, delivering the best value to customers through AI smart education and meeting solutions.",,,,,001Pp00000p9egoIAA.png,,
0013000001NuJb5AAF,"AIStorm, Inc.",9555,A,"AIStorm develops charge-domain computing chips and IP that deliver AI, memory, and digital processing directly in silicon—up to 100× more efficient and 30× smaller than transistor-based designs, enabling faster, cooler, smarter devices.",Yes,>50;000;000,Series C and beyond,> 1;000;000,0013000001nujb5aaf.png,,
0014V00003Ix96WQAR,"Aiworks Global, Inc.",54109,X,,,,,,,,
0014V00003spzKMQAY,Aizip,9021,A,"Aizip builds tiny AI models for edge and endpoint devices. With 4 years of experience and well established industry partners in consumer, hardware, and enterprise, they build the most robust solutions on the market and have millions of AI models shipping monthly around the world in audio, visual, time-series and language verticals.",,,,,0014V00003spzKMQAY.png,1,
0014V00003ThqY5QAJ,"AJ2 Co, Ltd.",50523,X,"AJ2’s unique core technology lies in the self-developed optical components —  specifically, the camera module and infrared LED, which account for more than Your eye is the key on the Security  70% of the performance and cost of the iris recognition system.",Yes,250;000-2;000;000,Series A,<500;000,0014V00003ThqY5QAJ.JPG,,
0014V00001gasxsQAA,AJProTech LLC,60317,M,"AJProTech is an award-winning IoT Product Development studio that builds new Consumer Electronics, Internet of Things, Wearables, Sports Tech, and AR/VR devices. We offer: hardware product development, electrical engineering, mechanical design, rapid prototyping, and manufacturing services. From idea to mass production.",No,,,,0014V00001gasxsQAA.jpg,,
001Pp000002vA4mIAE,Akko,31139,D,"Akko, founded in China in 2016, designs and manufactures “lifestyle gaming peripherals” with a cultural elements-driven, IP-inspired approach to make peripherals more than tools. We offer diverse mechanical keyboards and switches, sold in 60+ countries, backed by our 40,000㎡ Dongguan factory and integrated supply chain.",Yes,2;000;001-15;000;000,Pre-seed,> 1;000;000,001Pp000002vA4mIAE.png,,
001Pp00001NYSvNIAX,"AL.Robot Co., Ltd.",50523,X,"AL.Robot is a technology company developing precision force/torque sensors and robotic solutions. Applied in industrial automation, collaborative robots, medical rehabilitation, and mobility, our products deliver reliable force control and safety. With innovative material removal and surface finishing solutions, we enable next-generation",Yes,2;000;001-15;000;000,Series C and beyond,> 1;000;000,001Pp00001NYSvNIAX.png,,
0014V00003OuqVIQAZ,Algorized,51239,X,"Algorized software platform leverages proprietary machine learning algorithms and advanced sensor fusion techniques, including ultra-wideband (UWB) and wireless sensors, to enable real-time human presence sensing, and vital sign monitoring for automotive, industrial and in-door navigation.",,,,,0014V00003OuqVIQAZ.png,,
001Pp00000ncoRAIAY,All The Time Inc.,50335,X,"[Honoree : The Guide, AI Predictive Safety Ecosystem for Women]  All The Time Inc. is a state-of-the-art safety products specialist built on the principle of keeping everyday life safe with small preparations.   We aim to empower individuals to take charge of their own safety and to give confidence to living life anxiety-free.",No,,,,001Pp00000ncoRAIAY.png,,
001Pp000002cESGIA2,ALMAX,8776,A,"Design & Manufacturing Services: include Membrane Switches, Capacitive Switches & Sensing, Force Sensing, BioSensors, Smart Keypads, Integrated Assemblies, Rubber Keypads, Graphic Overlays, Printed Electronics, Labels, Nameplates, Rigid or Flexible Printed Circuit Boards & Complete Product Assemblies.",,,,,001Pp000002cESGIA2.png,,
0013000001KYV02AAH,"Alps Alpine North America, Inc.",3826,NN,"We conduct business across three segments: Components, Sensors and Communication, and Modules and Systems. Our products and services tend to the needs of customers in many different sectors, including automotive, consumer electronics, mobile devices and game markets. We also look to break ground and expand our horizons in new applications",No,,,,0013000001KYV02AAH.png,1,Collateral; Business Cards
0014V000046PvS5QAK,Altos Radar,6773,NN,High-performance & low-cost 4D imaging radars for high-level driver assistance systems and full autonomous driving.,,,,,0014V000046PvS5QAK.png,,
0013A00001egpuFQAQ,"Ambient Scientific, Inc.",8263,A,"Powered by groundbreaking innovations, Ambient Scientific brings both the software and hardware (Programmable AI processor chip) technologies to unleash the magic of AI in portable, tiny, battery powered electronics devices and Intelligent IoT sensors including AlwaysOn voice, AlwaysOn computer vision and AlwaysOn sensor fusion.",,,,,0013A00001egpuFQAQ.png,,
0013000001KaLvdAAF,American Registry For Internet Numbers (ARIN),10579,A,"ARIN is the nonprofit corporation that manages the distribution of Internet number resources – IPv4, IPv6, and Autonomous System Numbers (ASNs) – in many Caribbean and North Atlantic islands, Canada, and the United States. For more information about ARIN services, routing security, policy development and more visit www.arin.net.",No,,,,0013000001KaLvdAAF.png,,
0013000001KaMU7AAN,ams OSRAM,San Polo 3402,H,"The ams OSRAM Group is a global leader in intelligent sensors and emitters. By adding intelligence to light and passion to innovation, we enrich people’s lives. Our invited guests will “Sense the Power of Light” through interactive displays that show how our inspirational solutions are driving innovation in many industries.",,,,,0013000001KaMU7AAN.jpg,,
001Pp00001Is3vvIAB,ANA,9666,A,"Air to Ethanol! We have pioneered a revolutionary Atmosphere-to-Ethanol technology (CARBASIA) that directly converts atmospheric CO2 into ethanol.Our highly efficient, Made-in-Japan system utilizes an advanced Separation Membrane and a proprietary Electrolysis Cell within a compact unit.Booth 9666!",Yes,>50;000;000,Pre-seed,<500;000,001Pp00001Is3vvIAB.png,,
0014V00003F2fS9QAJ,ANELLO Photonics,10077,A,"ANELLO Photonics is creating navigation solutions for autonomy in GPS-Denied environments. ANELLO's Silicon Photonics Optical Gyroscope (SiPhOG) is a low-noise, low-drift optical gyroscope used for Inertial Navigation Systems to enable autonomy in Agriculture, Construction, Trucking, Drones/UAVs, Automotive and Defense.",No,,,,0014V00003F2fS9QAJ.png,,
001Pp00001UmwWBIAZ,AniMed Technology Limited,63200,M,"AniMed Technology Limited is a high-tech startup focused on edge intelligence and fiber optic sensing technologies, dedicated to developing next-generation vital sign monitoring systems. Integrating high-sensitivity fiber optic sensors with a low-power edge computing platform, it enables continuous, non-invasive monitoring of vital signs.",Yes,<250;000,Pre-seed,<500;000,001Pp00001UmwWBIAZ.png,,
001Pp00001GgtWJIAZ,Anivance AI Corporation,53410,X,"Anivance AI Corporation is a tech startup integrating miniaturized human organ systems on chips with Multi-Agent AI to accelerate drug discovery. Backed by 35 patents and thousands of data points across multiple organ and disease models, Anivance AI advances 20+ projects and expands across North America, Japan, South Korea, and Europe.",Yes,2;000;001-15;000;000,Seed,501;000-1;000;000,001Pp00001GgtWJIAZ.png,,
0013A00001hDw5dQAC,ANRITSU CORPORATION,6267,NN,"Anritsu Corporation is a global provider of innovative communications test and measurement solutions for 130 years. The company develops advanced solutions for 5G, M2M, IoT, as well as other emerging and legacy wireline and wireless communication markets.",No,,,,0013A00001hDw5dQAC.png,,
0013A00001Uad3VQAR,Antenova,10576,A,"Antenova is a leading supplier of high-performance antennas & RF solutions since 2001.   We provide comprehensive design advice, technical support & testing service. We have supplied the world with easy-to-integrate antennas for all kinds of wireless IoT applications, from smart cities/homes, connected healthcare, industry & wearables.",No,,,,0013A00001Uad3VQAR.jpg,,
0014V00003sqC7EQAU,Aqara LLC,51229,X,"Aqara has a broad smart home portfolio featuring lighting, door locks, sensors and cameras, and serves 11M+ customers. Focused on simplifying smart homes, Aqara embraces the Matter standard, ensuring compatibility with HomeKit, Alexa, Google, and SmartThings, and continually innovates for seamless integration and enhanced user experience.",,,,,0014V00003sqC7EQAU.png,,
001Pp00001M0fSjIAJ,Aquablu B.V.,18630,B,"Aquablu is redefining hydration with smart, health-focused technology and bold flavor experiences. Our products deliver freshly purified water — hot, cold and sparkling — infused with functional flavors. Recognized by Sifted, Red Dot Design Award and CBRE Innovation Award. Our North Star: hydrate one billion people.",Yes,15;000;001-50;000;000,Series A,> 1;000;000,001Pp00001M0fSjIAJ.png,,
0013A00001VJsajQAD,Arbe,4551,NN,"Arbe, the leader in Ultra-HD Radar for Perception, offers the key technology enabling safe, reliable, eyes-off driving at full highway speeds. Its 2,304 channel array delivers 300m+ free-space mapping and the weather-immune perception L3 has been waiting for.   Join us to experience the AI-powered next-level performance live at Booth #4551",No,,,,0013A00001VJsajQAD.png,,
0013000001LYDq8AAH,"ArcherMind Technology (Nanjing) Co., Ltd.",Westgate Hospitality Suites,N,"Founded in 2006 and headquartered in Nanjing, ArcherMind targets to be a global intelligent OS leader.  Mainly concentrates on technology research & development and solution services in the fields of automotive, intelligent terminals, AI, IoT and Mobile Internet.ArrayMo is specialized in R&D of intelligent vehicle OS-related products.",No,,,,0013000001LYDq8AAH.png,,
001Pp00000onUbKIAU,"Architech Co.,Ltd.",50816,X,"ArchiTech Co., Ltd provides innovative solutions utilizing Big Data, AI, and IoT to enhance construction safety and productivity. The integrated management system collects and analyzes real-time data to prevent accidents, optimize resources, and improve work efficiency.",,,,,001Pp00000onUbKIAU.png,,
0013000001LWc7jAAD,Aristotle Enterprises Inc.,10577,A,"Founded in 1980, Aristotle has over 25 years of expertise in antenna development, specializing in 5G NR, 4G/LTE, Wi-Fi 7, LPWAN, RFID, and UWB. All our products are 100% made in Taiwan. We also offer comprehensive testing services using MVG OTA chambers and expert RF troubleshooting to ensure optimal performance.",,,,,0013000001LWc7jAAD.jpg,,
001Pp00000pTVEMIA4,Artificial Intelligence and Robotics Institute,62643,M,"The Artificial Intelligence and Robotics Institute develops core and applied technologies in the field of advanced AI and robotics to solve national challenges and social problems, make life more convenient, safe, and healthy, and create new values for the future society.",Yes,<250;000,Pre-seed,<500;000,001Pp00000pTVEMIA4.png,,
001Pp00001Pq3EDIAZ,arvyax technologies private limited,60445,M,"ArvyaX is pioneering Pseudo-Reality, a world beyond AR/VR where imagination becomes tangible. Powered by AI, our screen-free device, SoulStrip, awakens your senses to live, work, and dream inside real ambience- yoga in mountains, work in forest, ocean reading, even magical moments you've dreamt of - everything is possible with Arvyax.",Yes,2;000;001-15;000;000,Pre-seed,<500;000,001Pp00001Pq3EDIAZ.png,,
0013A00001aJUGVQA4,Asahi Kasei Microdevices Corporation,54829,X,Asahi Kasei Microdevices (AKM) operates an electronic components business as a member of the Asahi Kasei Group's material sector. AKM provides customers with unique products by combining the compound semiconductor technology mainly used for magnetic sensors with the ASIC/analog circuit technology based on silicon semiconductors.,No,,,,0013a00001ajugvqa4.png,,
001Pp00001P70neIAB,ASC (Applied Sensor Co.),60452,M,"Applied Sensor Co. is a smart textile company that turns your physical space into a discreet, accurate data source. Helping you unobtrusive monitor and gather insights from textiles in your surroundings Mats, mattresses, chairs, curtains you name it!",Yes,250;000-2;000;000,Pre-seed,<500;000,001Pp00001P70neIAB.png,,
001Pp000004QGJnIAO,"AsiaRF Co., Ltd.",10676,A,"AsiaRF, a leader in wireless networking and IoT, specializes in innovative ODM services, enhancing global connectivity with advanced solutions like the Wi-Fi CERTIFIED HaLow IoT gateway, Wi-Fi 6E and Wi-Fi 7 modules, addressing diverse industrial and healthcare needs.",,,,,001Pp000004QGJnIAO.jpg,,
0013000001KYVJyAAP,Askey Computer Corp.,5667,NN,"Founded in 1989, Askey Computer Corporation is a member of AsusTEK Computer Inc., and leveraging 35 years of telecommunication development has created an industry leading portfolio of global 5G and private 5G end-to-end network solutions for modern business environments to enhance their digital transformations. Learn more at: askey.com",,,,,0013000001kyvjyaap.jpg,,
001Pp000003gFDpIAM,Association for Smarter Homes & Buildings (ASHB),32434,D,"ASHB is an international not-for-profit industry association committed to advancing smarter homes & buildings. Supported by an international membership of over 350 companies, ASHB focuses on all aspects of integrated home & building technology.",,,,,001Pp000003gFDpIAM.jpg,,
001Pp00001RxV9NIAV,ASYGN,60711,M,"ASYGN makes chips that make it possible for electronic devices to analyze and understand what they see. We believe that humans will communicate with devices through vision. Our latest innovation, ColibryNPU, brings embedded intelligence to image sensors, delivering AI data processing at ultra-low power levels.",No,,,,001Pp00001RxV9NIAV.png,,
001Pp00001NbfL8IAJ,Atitan Inc.,60265,M,"We cater to consumer and professional needs, by delivering  sophisticated hardware that simplifies connections between proprietary  technological devices and software that allows users to interact with media  and friends. We hope to bridge the gap between the current market of products and assist in  creating a future of advanced innovation.",Yes,2;000;001-15;000;000,Seed,<500;000,001Pp00001NbfL8IAJ.png,,
001Pp00001UYETOIA5,Atlas Soft Ltd.,50359,X,"Atlas Soft is a leading Hungarian software company specializing in innovative mobile device diagnostics, testing, and certification. Our flagship product, M360, offers professionals advanced tools to analyze, verify, and process smartphones and tablets—trusted by service centers and enterprises across Europe.",No,,,,001Pp00001UYETOIA5.png,,
