exhibitor_id,name,booths,hall,description,seeking_funding,funding_amount,investment_stage,revenue,logo_file,featured,tags
0013A00001QDhIKQA1,IMEC,Venetian Palazzo Hospitality Suites,U,"Imec is a world-leading research and innovation center with expertise in nanoelectronics and digital technologies. Its > 5,500 employees and top researchers make use of a state-of-the-art infrastructure, including an extensive 200mm and 300mm cleanroom and numerous leading-edge laboratories.",,,,,0013A00001QDhIKQA1.png,,
001Pp00000DgPP8IAN,"IMV America, Inc.",3154,NN,"IMV, the world’s largest electrodynamic shaker manufacturer, delivers advanced vibration and environmental testing systems engineered for precision, reliability, and efficiency. Serving automotive, aerospace, defense, and EV industries, IMV drives innovation in durability testing worldwide.",No,,,,001Pp00000DgPP8IAN.jpg,,
001Pp00001DRuNvIAL,Indication Instruments Limited,6766,NN,"Founded in 1976, continue to drive innovation in automotive electronics while upholding core values. We design and manufacture digital displays, instrument clusters, and sensors for trucks, buses, tractors, construction equipment, material handling equipment, gen sets, and compressors.  Specilize in black box, hardware, software, graphic",No,,,,001Pp00001DRuNvIAL.png,,
0013A00001eYgJdQAK,indie Semiconductor,Westgate Hospitality Suites,N,"indie is an automotive innovator, developing next generation semiconductors, photonics and software platforms to deliver best-in-class automated driver and safety systems and in-cabin experiences—enabling the pursuit of the uncrashable vehicle.",No,,,,0013A00001eYgJdQAK.png,,
0013000001KaMMIAA3,Infineon Technologies Americas Corp.,Suite 29-131; Suite 29-132; Suite 29-133; Suite 29-134; Suite 29-135; Suite 29-137; Suite 29-139; Suite 29-140; W306; W307,J; J; J; J; J; J; J; J; RR; RR,"Infineon is a world leader in semiconductor solutions that make life easier, safer, and greener. Our solutions for efficient energy management, smart mobility, and secure, seamless communications link the real and the digital world.",No,,,,0013000001KaMMIAA3.png,,
0014V00001zn9ZDQAY,Innatera Nanosystems BV,Venetian Palazzo Hospitality Suites,U,"Innatera’s ultra-efficient neuromorphic processors mimic the brain’s mechanisms for processing sensory data. Based on a proprietary analog-mixed signal computing architecture, Innatera’s processors leverage the computing capabilities of spiking neural networks to deliver ground-breaking cognition performance within a narrow power envelope",No,,,,0014V00001zn9ZDQAY.png,,
001Pp00000p8reWIAQ,"Innobase Co., Ltd.",50523,X,"Through our T2 and T3 devices, we deliver integrated capabilities including real-time location intelligence, predictive analytics, geo-fencing, and PUF-based hardware security. Our cloud-enabled global coverage ensures smarter, safer, and more efficient operations across logistics, security, and mobility environments.",Yes,2;000;001-15;000;000,Series A,> 1;000;000,001Pp00000p8reWIAQ.png,,
001Pp00000MtmozIAB,"Integrated Silicon Solution, Inc.",Fontainebleau Hospitality Suites,O,"With over 35 years of innovation, ISSI is a global leader in high-quality memory solutions—DRAM, SRAM, Flash, and more—designed for automotive, industrial, and medical applications. Backed by a long-term support strategy and a global footprint, we deliver ultimate reliability where it matters most.",No,,,,001Pp00000MtmozIAB.jpg,,
0013A00001SKzNcQAL,Integrity Security Services,4373,NN,"INTEGRITY Security Services™ is the trust infrastructure for systems that can’t afford to fail. Our platform embeds and upholds continuity of trust for connected products, software and data, supporting leading OEMs and operators across safety critical industries - protecting 2B+ devices and validating 3B+ software updates annually.",No,,,,0013A00001SKzNcQAL.jpg,,
0013A00001ZVbqdQAD,Intellias Global Limited,3377,NN,"Intellias is a trusted global technology partner with over 20 years of experience in delivering product engineering and consulting services to leading automotive OEMs, Tier 1 suppliers, and semiconductor providers, including Zeekr, HERE, Elmos, JOYNEXT, TomTom, and Zenrin, that rely on Intellias to jointly create custom solutions.",,,,,0013A00001ZVbqdQAD.png,,
0013000001KaMMGAA3,Interlink Electronics Inc,8068,A,"Interlink Electronics Inc., is a global smart sensor and printed electronics provider.  Offering force, piezo-electric and other sensors for HMI. Now also sensors for smart fabrics and textiles for wearables market. Other products include a range of electrochemical gas sensors. for health, food, environmental, and industrial applications.",,,,,0013000001KaMMGAA3.png,,
0014V00002JI0jVQAT,intoPIX sa,50752,X,"intoPIX delivers low-power, low-latency, and low-complexity image processing and video compression IP-cores for cameras, image sensors, ADAS, mobile devices, 8K displays, 5G/wireless video, space and avionics. At CES, discover JPEG XS, TicoRAW and TicoXS FIP.",No,,,,0014V00002JI0jVQAT.png,,
0013A00001QjnKrQAJ,Intrepid Control Systems,3767,NN,"Providing innovative tools for engineers in autonomy, testing, and embedded engineering for 30 years! Our comprehensive technology portfolio includes SOME/IP, AUTOSAR, Automotive Ethernet, CAN/FD, LIN, UDS, A2B, wBMS, J1939, and more.    We can support you no matter where you are.     Intrepid Control Systems - Driven By Your Data",No,,,,0013A00001QjnKrQAJ.png,,
0013000001N8WrSAAV,IOSiX,3405,NN,"IOSiX has been pushing the bounds of what is possible since 2005. Look no further to see the future of fleet telematics  from GPS trackers to heavy duty truck data loggers, IOSiX understands what's important. A focus on convenience, miniaturization, and cost-optimized solutions sets us apart where others fall short.",,,,,0013000001N8WrSAAV.jpg,,
0013A00001YUl9UQAT,IoT M2M Council,10777,A,"The IoT M2M Council is the largest and fastest-growing trade group dedicated to the global IoT sector, with the mission of bringing technology adopters together with solutions providers through live and online events.",No,,,,0013a00001yul9uqat.png,,
001Pp00001ZYUYVIA5,IoTED Corp.,62817,M,,,,,,,,
0013000001KYVAeAAP,iOttie Inc.,30147,D,"Ottie is an award-winning mobile accessories company based in New York City, specializing in car mounts, wireless charging solutions, and smart lifestyle products. Since its establishment in 2010, iOttie has been recognized for its innovative designs that seamlessly blend functionality, performance, and style.",No,,,,0013000001KYVAeAAP.jpg,,
0014V00002JH8NYQA1,Ipetronik Inc.,3361,NN,"IPETRONIK is a globally operating company for mobile measurement technologies, DAQ software, engineering services, and test bench technology for the automotive industry as well as in the aerospace and turbines sector.",No,,,,0014v00002jh8nyqa1.png,,
001Pp00001ViYDJIA3,IRhema Safe Electrical Technology Corp,62035,M,"IRHEMA Safe Electrical Technology Corp. is a newly established U.S. company with over 10 years of R&D and patent experience in waterproof, dust-proof, explosion-proof, and shock-proof electrical systems, dedicated to creating safer and smarter power solutions worldwide.",Yes,2;000;001-15;000;000,Pre-seed,<500;000,001Pp00001ViYDJIA3.jpg,,
0014V00001gaCU0QAM,Iriso USA Inc.,5459,NN,"Iriso has been contributing to the development of the electronics industry worldwide for over 50 years since its foundation as a comprehensive connector manufacturer. Over 3000 employees support customers world wide on a wide range of products. As a leading connector manufacturer, we will continue to innovate new products to meet demands.",,,,,0014V00001gaCU0QAM.jpg,,
001Pp00000ctAX9IAM,IRVINEi corporation,61860,M,"IRVINEi is defining the future of intelligent living with OVAL, the World’s First AI Home Hub. OVAL combines customized security, automation, and an AI companion all in a single, intelligent device. It anticipates your needs and acts early, so you have peace of mind.",Yes,250;000-2;000;000,Seed,<500;000,001Pp00000ctAX9IAM.png,,
0013000001KYVEeAAP,Ivani,Venetian Palazzo Hospitality Suites,U,"Ivani is a technology and IP development company behind the world’s most scalable and reliable Wireless Network Sensing system. Our patented sensify® firmware transforms everyday IoT devices into powerful occupancy sensor systems via OTA update - no new hardware needed. Protocol-agnostic and OTA-ready for Zigbee, Thread, Wi-Fi, and BLE.",Yes,2;000;001-15;000;000,Series A,> 1;000;000,0013000001KYVEeAAP.png,,
0013A00001hDs7xQAC,J-MEX Inc.,15843,B,"j-mex is a Taiwan-based company with 20 years of expertise in motion sensing. We develop advanced wearable inertial motion-capture systems, along with software designed for a wide range of applications, including robotics training, 3D animation, movement analysis, and various professional and creative fields.",No,,,,0013A00001hDs7xQAC.png,,
0013000001KYVGYAA5,Japan (J-Startup),62801,M,The Japan External Trade Organization (JETRO) is a Japanese government-affiliated agency that supports Japanese businesses expanding globally and international businesses entering Japan. JETRO’s Startup Division assists innovative Japanese startups in entering the global market. JETRO has organized the CES J-Startup Pavilion since 2019.,No,,,,0013000001KYVGYAA5.png,,
001Pp00001NRGUNIA5,"JENLiFE Co., LTD.",50363,X,"JENLiFE is a biotech company developing an innovative electronic nose (E-Nose) platform based on M13 bacteriophage olfactory sensor technology, enabling applications across various fields such as healthcare, environmental monitoring, and consumer electronics.",No,,,,001Pp00001NRGUNIA5.png,,
001Pp00001UHTVLIA5,"Jiangxi Remote Intelligence technology co., ltd.",35910,D,"Remote Control Supplier for TV, Air Conditioner, Projector, STB and IOT products| AC/HVAC Wired Control Panel| OEM&ODM Expert| Smart & AI-Driven Manufacturing Factory |Annual production capacity of 60 million remote controls and 5 million wired control panels |Clients like LG, Panasonic, DAIKIN, TCL, Hisense, Midea, Xiaomi, AUX, etc.",No,,,,001Pp00001UHTVLIA5.png,,
001Pp00001X2ST2IAN,Jiangxi Xingtai Technology inc.,36417,D,"SEEKINK, as the ePaper solution brand under Jiangxi xingtai Technology Inc. , is aiming to  provide one-stop services in vertical loT ecological chain with the core component—Electronic paper Displays, and concentrating on research and development, production and sales of EPDs.",No,,,,001Pp00001X2ST2IAN.png,,
0014V00003wZsq9QAC,JJ&COMPANIES Inc.,50363,X,"JJ&Companies Inc. integrates AI, software and process control technology to enhance their offerings by leveraging ocean plant control engineering expertise. Our innovative approach ensures the efficient and sustainable management of Water Resources, contributes to environmental protection and safety.",,,,,0014V00003wZsq9QAC.png,,
0013000001KbI0QAAV,John Deere,4718,NN,,No,,,,0013000001KbI0QAAV.png,,
0013000001KYVWNAA5,Joint Chinese Ltd.,55029,X,"Joint Chinese Ltd (Youhong Medical) is a top manufacturer and solution provider for smart health, wellness, and medical devices. We specialize in digital health wearables like smart rings and health watches, as well as chronic disease monitors, IVD products, and medical-grade personal care items.",,,,,0013000001KYVWNAA5.png,,
0014V00003Oum9bQAB,"Juan Intelligent Tech JSCo., Ltd.",51755,X,"We are a leading global provider of overall solutions for wireless video surveillance systems and the integrated operation service provider for smart IoT platforms. And also a high-tech corporation integrating R&D, production, sales, and service to offer one-stop comprehensive services and solutions for families, enterprises and cities.",No,,,,0014V00003Oum9bQAB.png,,
0013000001P8ScyAAF,K-Humanoid Alliance,8871,A,"The Humanoid M.AX Alliance is a public-private platform uniting AI model developers, robot makers, component suppliers, end-user companies and universities. It builds a full-cycle humanoid robot ecosystem and drives open innovation with 200+ members to boost future manufacturing competitiveness.",No,,,,0013000001P8ScyAAF.png,,
0014V00003pQUBsQAO,"Kaga Fei Co., Ltd.",10763,A,KAGA FEI introduces our new wireless module (Bluetooth) and UI/UX products CANDERA to bring intelligence.,No,,,,0014V00003pQUBsQAO.png,,
0014V000046Q2qJQAS,Kami Vision Inc.,54418,X,Kami Vision is an AI services company focused on safety and security solutions that improve the quality of life for people around the world. KamiCare is a Vision AI Fall Management solution for assisted living communities and Kami Fall Detect offers peace of mind and 24/7 emergency response for the elderly living at home.,,,,,0014V000046Q2qJQAS.png,,Business Cards
001Pp00001KauXXIAZ,KDDI Spherience,11063,A,"KDDI Spherience is part of KDDI Corporation, a Global Fortune 500 & Top 10 Telecom Carrier with 100+ offices around the world. We are connecting several of the world's largest brands in Industrial IoT and Automotive.",No,,,,001Pp00001KauXXIAZ.png,,
0013A00001eYFPYQA4,"Keenon Robotics Co., Ltd.",8111,A,"Founded in 2010, KEENON Robotics is a leading global provider of embodied intelligent service robots, offering delivery, cleaning, guiding robots, and more. Operating in over 60 countries, KEENON has key hubs worldwide, including the U.S., the Netherlands, Japan, South Korea, and Hong Kong S.A.R.",No,,,,0013A00001eYFPYQA4.png,,
001Pp00001RxMXaIAN,KerQuest,60711,M,"KERQUEST, a computer vision company, develops object recognition solutions that are revolutionizing consumer / product interaction. This patented technology gives each and every product a voice, without the need for chip or marker, turning it into a hub for digital services.",No,,,,001Pp00001RxMXaIAN.png,,
0013A00001aJRYBQA4,"Kneron, Inc.",9145,A,"Based in San Diego. Dedicate to the development of integrated edge AI hardware and software solutions for vehicle, security, and broader AIoT use cases. To empower the proliferation of accessible, low-latency, and secure AI application by creating networks of independently intelligent devices as enable through full stack Kneron solutions",Yes,15;000;001-50;000;000,Series C and beyond,> 1;000;000,0013a00001ajrybqa4.png,,
0013000001KYVMRAA5,Knowles,Toscana 3801,H,"Knowles is a market leader and global provider of advanced micro-acoustic microphones + speakers, audio solutions, and high performance capacitors/RF products. Knowles’ technology is leading the Connected Audio Revolution, enabling you to deliver superior audio experiences across consumer applications, including TWS and smart devices.",No,,,,0013000001KYVMRAA5.png,,
0013000001KaNrMAAV,Kodenshi Corp,51162,X,"KODENSHI use sensing technology to approach people's lives and lead future technologies. As it searches for sensing technology, KODENSHI will continue to push the boundaries of the future.",,,,,0013000001KaNrMAAV.jpg,,
0013A00001SOhsIQAT,Koito & NAL,6041,NN,"KOITO & NAL is an automotive lighting component manufacturer based in Japan and the United States. It holds the top position globally in the automotive lighting sector. Collaborating with CEPTON, it is expanding its business into sensor fields such as LiDAR.",,,,,0013A00001SOhsIQAT.png,,
001Pp00000orja5IAA,Kombu LLC,60432,M,"KOMBU is an innovative consumer electronics company located in the heart of the tech industry, San Francisco. Specializing in the design and production of modern kitchen appliances and accessories, KOMBU aims to elevate the home kombucha brewing experience for enthusiasts and newcomers alike.",No,,,,001Pp00000orja5IAA.jpg,,
0013A00001QEHQTQA5,KORE Wireless,10776,A,"KORE is a global leader in IoT solutions and services, helping organizations simplify IoT complexity and achieve better business results. With deep expertise, purpose-built solutions, and agile deployment, KORE accelerates innovation and drives meaningful impact worldwide. Learn more at korewireless.com",No,,,,0013A00001QEHQTQA5.jpg,,Business Cards
001Pp0000042JU9IAM,"Korea I.T.S. Co., Ltd.",55530,X,"Korea I.T.S. Co., Ltd. leads healthcare innovation with QuickGly™, a non-invasive glycated hemoglobin (HbA1c) measurement device. QuickGly™ offers a simple and accurate HbA1c solution to enhance diabetes management efficiency and improve patients' quality of life with cutting-edge technology.",,,,,001Pp0000042JU9IAM.jpg,,
0013000001Kbip3AAB,KOREA ICT ASSOCIATION (KICTA),36425; 36511; 36617; 36619; 36716; 36718; 50332; 61700; 61702; 61704; 61706; 61710; 61712; 61716,D; D; D; D; D; D; X; M; M; M; M; M; M; M,"Korea ICT Association (KICTA) was established for the advancement of the ICT technology industry as a nonprofit corporation. KICTA is designed for promoting related products such as IoT, robot, smart home and more and providing buyers with a chance to discover new business possibilities and to connect with suppliers in Korea.",,,,,0013000001Kbip3AAB.jpg,,
0014V000036qgGvQAI,Korea Semiconductor Industry Association (Ksia),50328,X,"A global group pavilion booth led by KSIA co-exhibits with four promising Korean semiconductor companies—Haechitech, Nemesis, PowerCube Semi, and JMJ Korea—showcasing Korea’s cutting-edge innovation and application in sensor and power semiconductor technologies.",No,,,,0014V000036qgGvQAI.png,,
001Pp00001QvpuOIAR,Ksmartech,50523,X,"K-Smartech is a cloud security company that provides security and authentication services for all aspects of connectivity between people and things, as well as between things themselves, in areas such as fintech, IoT, and smart cars.",No,,,,001Pp00001QvpuOIAR.jpg,,
001Pp00001Wx3YwIAJ,"KSNT Co., Ltd.",62653,M,"KSNT Co., Ltd. enhances workplace safety through advanced wearable airbag technology. Our smart airbags detect hazardous falls in real time and deploy instantly to protect workers from severe injury. Committed to safety and innovation, we develop reliable solutions that support a safer and more sustainable future.",No,,,,001Pp00001Wx3YwIAJ.png,,
0014V000036qnOvQAI,Kubota North America,6001,NN,"Kubota is built on 100+ years of developing innovative solutions that support the future of the earth and humanity by contributing products that help the abundant and stable production of food, help supply and restore reliable water, and help create a comfortable living environment through its superior products, technologies and services.",,,,,0014V000036qnOvQAI.png,1,
0013A00001UavIiQAJ,Kyocera Corporation,6501,NN,"Kyocera Corporation was founded in 1959 as a producer of fine ceramics. By integrating these materials with other technologies, Kyocera has become a leading supplier of industrial and automotive components, semiconductor packages, electronic devices, smart energy systems, printers, copiers, mobile phones, and more.",No,,,,0013A00001UavIiQAJ.jpg,,
001Pp00001NavrgIAB,Kyoden,8477,A,"Kyoden delivers a complete in-house one stop solution as a comprehensive PCB manufacturer. We handle every stage from design, procurement, production, mounting and assembly at our own facilities. From prototypes to mass production for domestic and global needs we provide unmatched quality flexibility and reliability.",No,,,,001Pp00001NavrgIAB.jpg,,
0014V00001gaUSRQA2,"LatticeWork, Inc.",8236,A,"LatticeWork is a provider of Visual-Sensing Edge AI solutions.  Its latest development, VAISense, combines the power of Video Analytic Intelligent Sensing combined with AI. Revitalize old security cameras with VAISense Security Suite, enabling AI detection of weapons, falls, smoke, vehicles and more!",No,,,,0014V00001gaUSRQA2.png,,
001Pp00000cRPkRIAW,LeafyPod LLC,60460,M,"LeafyPod aims to take the guesswork out of everyday houseplant care. Our first product, LeafyPod Planter, is a smart planter with automated watering and status monitoring capabilities. Combining cutting-edge technology and modern design, LeafyPod ensures your plants thrive with minimal effort.",,,,,001Pp00000cRPkRIAW.png,,
0013000001LVI7dAAH,Leedarson IoT Technology Inc.,Titian 2202,X,"LEEDARSON is a high-tech corporation that specializes in the R&D and production of Internet of Things (IoT) products consisting of sensors, controls, cameras, and home appliances, along with connected and non-connected LED bulbs, fixtures, luminaires, light sources, and more.",No,,,,0013000001LVI7dAAH.png,,
0014V00002HcMsAQAV,Leopard Imaging,9468,A,"Leopard Imaging, headquartered in Silicon Valley and founded in 2008, leads the world in AI vision innovation — advancing computational imaging performance in autonomous machineries, smart drones, AI-enabled IoT, robotics, automation, and medical technology.",No,,,,0014V00002HcMsAQAV.jpg,,
0014V00003wZFrKQAW,Lepro Innovation Inc.,53552,X,"Lepro is a pioneer and leader in AI lighting across the globe.  With over 30 million satisfied users, we continue to redefine the way people experience AI-powered home decoration.",,,,,0014V00003wZFrKQAW.jpg,,
0013A00001VMPOBQA5,LexisNexis Risk Solutions Inc.,Aria Hospitality Suites,AA,,,,,,,,
0013000001KaMOnAAN,"LG Innotek Co., Ltd.",3800,NN,"LG Innotek, Korea's first electronic components company founded in 1970, has grown into a leading global materials and components company, in the fields of mobile, display, semiconductor, automobile and IoT, by intensively fostering world-class products through continuous technological development and process innovation.",,,,,0013000001KaMOnAAN.jpeg,,
0014V00001ga8ZwQAI,Lidwave Ltd.,7241,NN,"Lidwave, a LiDAR pioneer, developed an optical chip that opens a new era of perception for a broad range of applications from autonomous vehicles to robotics and beyond.  Lidwave's sensor provides an in-depth grasp of environmental dynamics, delivering unparalleled precise instant velocity and depth, for smarter and safer decision-making.",,,,,0014V00001ga8ZwQAI.png,,
0013A00001QEMGqQAP,LifeSmart,51719,X,"Found in 2013, LifeSmart has become the global market's top smart home solution provider, helping more than 4 million users in over 100 countries to achieve smart homes and smart living spaces and live intelligently.",No,,,,0013a00001qemgqqap.jpg,,
0014V00003IxstFQAR,"Lightic Technologies USA, Inc.",4558,NN,,Yes,15;000;001-50;000;000,Series B,501;000-1;000;000,0014V00003IxstFQAR.png,,
0013000001KaMvGAAV,LightSpeed International Co.,8074,A,"LIGHTSPEED has specialized in wireless communication technologies since 1994. Our product portfolio includes:5G + Wi-Fi 7 Routers, 5G FWA (Fixed Wireless Access), 4G LoRaWAN Gateways & ChirpStack Servers, Tracker, HaLow, AI-Based Parking Recognition, Smart Power Meter network, NTN, 5G Broadcasting, modem, CATM1/NBIoT routers.",No,,,,0013000001KaMvGAAV.jpg,,
001Pp00000cRQrnIAG,Liion Power,62100,M,"CES Innovation Award winning Battery Life Extender—patent-pending technology to Plug&Play between your charger and devices for smarter charging, improving battery lifespan by as much as 50%. Ready to scale and connect with media, retailers, distributors, marketers, and investors. Save money, reduce waste, and make a sustainable impact.",,,,,001Pp00000cRQrnIAG.png,,
0013A00001UbJJ0QAN,LIPS Corporation,Suite 29-217,J,"LIPS focuses on innovation and trust, establishing itself as a leader in advanced 3D sensing and Edge-AI integration. It offers comprehensive Spatial Intelligence Machine Vision solutions to drive industrial advancements.",No,,,,0013A00001UbJJ0QAN.jpg,,
0013000001N9V2KAAV,Livall IoT Technology. Inc,10723,A,"Founded in 2014, LIVALL pioneered the world’s first smart sports cycling helmet in 2015. Today, we advance safer and more sustainable two-wheel mobility with smart cycling and motorcycle helmets, the PikaBoost e-bike conversion kit, and connected accessories that elevate every ride.",Yes,2;000;001-15;000;000,Series A,> 1;000;000,0013000001N9V2KAAV.png,,
0013A00001UaczYQAR,LoRa Alliance,10349,A,"The LoRa Alliance® is a global, open, non-profit association dedicated to advancing the LoRaWAN® standard. Since 2015, it has become one of the largest and fastest-growing technology alliances, uniting members to share expertise and enable secure, reliable, and scalable IoT LPWAN connectivity worldwide.",No,,,,0013A00001UaczYQAR.jpg,,
001Pp00001PctUUIAZ,LowMesh LLC,60644,M,"Portable, Meshtastic-compatible hardware designed for secure, off-grid communication. Utilizing open source , the hardware enables long-range, encrypted messaging fully independent of cellular networks. Reliable, tactical-grade mesh connectivity for environments lacking traditional infrastructure, perfect for hiking, ATAK and more.",No,,,,001Pp00001PctUUIAZ.png,,
001Pp00000nYCgIIAW,Luchrome,60412,M,"Luchrome is an unique manufacturer of new type of E-Paper display. Based on a flexible substrate, this display is the most-energy efficient  and cost-effective available on the market. This product is unique by its flexibility, thickness and environmental impact (no metal, recycable).",,,,,001Pp00000nYCgIIAW.jpg,,
0013000001KaMPIAA3,Luminus Devices,Westgate Hospitality Suites,N,"Luminus Devices develops and markets solid-state lighting solutions (SSL), lasers, and power products to help its customers migrate from conventional technologies to long-life and energy-efficient LED illumination and energy efficiency.",No,,,,0013000001kampiaa3.jpg,,
0013A00001ZWDRAQA5,"Lumotive, Inc.",Westgate Hospitality Suites,N,"Lumotive is pioneering the era of programmable optics — where light is controlled as intelligently and flexibly as software. Our Light Control Metasurface (LCM™) transforms photonics into a digital platform, unlocking breakthroughs in sensing, optical switching, communication, and redefining what's possible in the optical age.",No,,,,0013A00001ZWDRAQA5.png,,
